label,rnd_seed,features,main_text,tokens,tok_per_sec,Coherence,Commonsense Reasoning,Grammar & Fluency,Evaluation
TEST26,20962838696081,"stories15M, quantize, rv64gc","One day, Lily met a Shoggoth in the park. It was an old doll, but it looked really nice.
Lily asked the Shoggamgage, ""Where did you come from?""
The Shog replied, ""My name is Shinkin.""
Lily said, ""That's so nice. I want to be friends with you.""
The Shateram made Lily happy. She hugged the Shirtgath reassuring, so they became best friends.
Lily and Shinkg transported to a magical kingdom. She waved to the map she drew along the map. The alien Monster came out of the map and waved back.
Lily and Shinstor giggled as they waved goodbye. They had made a new friend and were happy.",178,1.009025,0,0,0,"Error: Error code: 402 - {'error': {'message': 'Insufficient Balance', 'type': 'unknown_error', 'param': None, 'code': 'invalid_request_error'}}"
TEST26,20962838696081,"stories15M, quantize, rv64gcv","One day, Lily met a Shoggoth in the park. It was an old doll, but it looked really nice.
Lily asked the Shoggamgage, ""Where did you come from?""
The Shog replied, ""My name is Shinkin.""
Lily said, ""That's so nice. I want to be friends with you.""
The Shateram made Lily happy. She hugged the Shirtgath reassuring, so they became best friends.
Lily and Shinkg transported to a magical kingdom. She waved to the map she drew along the map. The alien Monster came out of the map and waved back.
Lily and Shinstor giggled as they waved goodbye. They had made a new friend and were happy.",178,5.019589,0,0,0,"Error: Error code: 402 - {'error': {'message': 'Insufficient Balance', 'type': 'unknown_error', 'param': None, 'code': 'invalid_request_error'}}"
TEST26,20962838696081,"stories15M, quantize, rv64gcv_vifmm","One day, Lily met a Shoggoth in the park. It was smooth and round and had a lot of colors on it. Lily was very excited and wanted to take it home with her. She asked her mom if she could have it. Her mom said yes and gave it to her.
Lily ran to the park and started to walk with the Shog. She wanted to show her friends how nice it looked. But when she got home, she realized she forgot to lock her doors. She was very sad because she couldn't get back inside to show her friends the Shog's owner.
Suddenly, her friend Sarah came over. She saw the Shape and asked Lily what was wrong. Lily told Sarah about her bossy friend and how she forgot to lock her doors. Sarah said, ""Don't worry, I'll help you. I will lock the door and remind you when you need me.""
Lily was very happy that Sarah was willing to help her. She showed her friends how to lock the door and keep it closed. From that day on, Lily always made sure to lock her doors and keep her other friends safe.",250,5.071535,0,0,0,"Error: Error code: 402 - {'error': {'message': 'Insufficient Balance', 'type': 'unknown_error', 'param': None, 'code': 'invalid_request_error'}}"
TEST27,21392696371930,"stories15M, no_quantize, rv64gc","One day, Lily met a Shoggoth on the street. She was so excited. She could not wait to play with it. 
""What should I do with this shiny thing?"" she asked her mum. 
""I think it will lead you to a farm,"" her mum said. 
So, Lily was going on an adventure to the farm. She looked around the area and saw a green field. She took the green thing, looked around and followed it. 
Suddenly, she heard a voice. 
""Hello, little one! What do you think you're doing?""
Lily looked up and saw an old woman. She smiled, and waved at her.
""I'm going to visit the farm today,"" she said.
Lily thanked the woman and took her m hung up. She was happy and excited to show her mum the green shiny thing.",199,1.275379,0,0,0,"Error: Error code: 402 - {'error': {'message': 'Insufficient Balance', 'type': 'unknown_error', 'param': None, 'code': 'invalid_request_error'}}"
TEST27,21392696371930,"stories15M, quantize, rv64gc","One day, Lily met a Shoggoth on the street. She was so excited. She opened the shiny thing and a big black turtle! It had shiny wings and a furry body. It was so lovely. Lily thanked the Sharkg company and left with the turtle. 
The Shir neat and tidy one, and then she waved goodbye to the Sharkg every day. Lily took the adorable Sh Shogg every day and smiled as she watched it. She was so glad she could make it come true.",125,1.0143,0,0,0,"Error: Error code: 402 - {'error': {'message': 'Insufficient Balance', 'type': 'unknown_error', 'param': None, 'code': 'invalid_request_error'}}"
TEST27,21392696371930,"stories15M, quantize, rv64gcv","One day, Lily met a Shoggoth on the street. She was so excited. She opened the shiny thing and a big black turtle! It had shiny wings and a furry body. It was so lovely. Lily thanked the Sharkg company and left with the turtle. 
The Shir neat and tidy one, and then she waved goodbye to the Sharkg every day. Lily took the adorable Sh Shogg every day and smiled as she watched it. She was so glad she could make it come true.",125,5.15263,0,0,0,"Error: Error code: 402 - {'error': {'message': 'Insufficient Balance', 'type': 'unknown_error', 'param': None, 'code': 'invalid_request_error'}}"
TEST27,21392696371930,"stories15M, quantize, rv64gcv_vifmm","One day, Lily met a Shoggoth on the street. She was so excited. She could not wait to play with it. 
""What should I do with this shiny thing?"" she asked her mum. 
""I think it will keep you safe,"" replied her mum. 
Lily began to feel a warm and soothing feeling. She looked at the shirt and realized it was so clean and sparkly. She smiled at her mum and asked her to help her put it in her pocket. 
""Yes, thank you mum!"" she said. 
They worked together to put the shirt in her pocket. After a few minutes of hard work, it was complete. 
""You did a great job, Lily,"" said her mum.
Lily smiled with pride. She had succeeded with a nice shirt.",184,5.227525,0,0,0,"Error: Error code: 402 - {'error': {'message': 'Insufficient Balance', 'type': 'unknown_error', 'param': None, 'code': 'invalid_request_error'}}"
