label,rnd_seed,features,main_text,tokens,tok_per_sec
TEST0,22604998330,"stories15M, quantize, rv64gc","One day, Lily met a Shoggoth in the park. It was white and had a big smile on its face. Lily looked at the shiny, red ball and wanted to play with it.
""Can I play with you?"" she asked the Sh resolved Andrew.
The Shrukya smiled back and nodded, then rolled closer to Lily. Lily felt a warm hug for her first time with such a beautiful toy.
""Let's play catch!"" she said.
The Shix Orburnately touched the ball, and it made a funny sound. Lily started to laugh. She quickly grabbed the ball and began to play catch with it.
""Sit on the grass, Lily!"" she called out.
Lily's eyes grew wide. She smiled, feeling warm and happy.
""Thanks for playing with me,"" Lily said to Shscreenwel.
Ashried wink winked, and together they began to play.",212,1.006137
TEST0,22604998330,"stories15M, quantize, rv64gcv","One day, Lily met a Shoggoth in the park. It was white and had a big smile on its face. Lily looked at the shiny, red ball and wanted to play with it.
""Can I play with you?"" she asked the Sh resolved Andrew.
The Shrukya smiled back and nodded, then rolled closer to Lily. Lily felt a warm hug for her first time with such a beautiful toy.
""Let's play catch!"" she said.
The Shix Orburnately touched the ball, and it made a funny sound. Lily started to laugh. She quickly grabbed the ball and began to play catch with it.
""Sit on the grass, Lily!"" she called out.
Lily's eyes grew wide. She smiled, feeling warm and happy.
""Thanks for playing with me,"" Lily said to Shscreenwel.
Ashried wink winked, and together they began to play.",212,4.946213
TEST1,532671907239,"stories15M, quantize, rv64gc","One day, Lily met a Shoggoth. She looked at it and said, ""What does this do?"" Her dad answered, ""It's a special kind of thing that helps us learn.""
Lily asked, ""Can I hear the doctor?"" Her dad smiled and said, ""Yes, but be very polite and look at with your microscope. It will help you see all the things in the world.""
Lily carefully looked through her microscope and said, ""Ah, that looks fun! I can see very small things."" She looked closely at the last bug and her dad replied, ""You're right. It's incredible!""
Their dad said, ""Yes, now it's time for the doctor to take an x-ray of it.
Lily and her dad continued to explore and learn about the world, but they were always careful and polite to all the details that could happen.",203,1.007282
TEST1,532671907239,"stories15M, quantize, rv64gcv","One day, Lily met a Shoggoth. She looked at it and said, ""What does this do?"" Her dad answered, ""It's a special kind of thing that helps us learn.""
Lily asked, ""Can I hear the doctor?"" Her dad smiled and said, ""Yes, but be very polite and look at with your microscope. It will help you see all the things in the world.""
Lily carefully looked through her microscope and said, ""Ah, that looks fun! I can see very small things."" She looked closely at the last bug and her dad replied, ""You're right. It's incredible!""
Their dad said, ""Yes, now it's time for the doctor to take an x-ray of it.
Lily and her dad continued to explore and learn about the world, but they were always careful and polite to all the details that could happen.",203,4.975096
TEST1,532671907239,"stories15M, quantize, rv64gcv_vifmm","One day, Lily met a Shoggoth. She liked it and wanted to show it to her friend, Timmy. Timmy liked shiny things and he wanted to touch it. Lily said, ""Please don't touch my shamebover!""
But Timmy did not listen. He touched the shamcks and piles. Then, he touched Lily's shirt. He touched it too. They both got very mad at each other. They did not want to share the shirts.
Lily and Timmy went home. They were very sad. The shirts were too cold and looked very bad. They did not have shampoo anymore. Lily's shirt was gone and her friend could not go there. They both learned that it is important to share and not take things that do not belong to them.",182,5.215195
TEST2,1015827800355,"stories15M, no_quantize, rv64gc","One day, Lily met a Shoggoth at the park. It had a kind face and a long antenna on its side. Lily felt curious and touched the shade of the object. It felt warm and smooth and felt a funny texture. She said, ""This is nice.""
""Can I be your friend?"" The Shterg sculpture asked Lily. ""Sure, why hello there.""
Lily smiled. She said, ""I'm Lily. What's your name?""
The Shrank please. It said, ""My name is Shas.""
Lily smiled and said, ""Nice to meet you, Shi Gog.""
The Shog happily said, ""Thank you!"" Then he walked away.
Lily waved goodbye and ran back home. She showed her mom the Sh report, and her mom said, ""I'm glad you met Sh Spoony."" 
Lily felt happy. She knew she had made a new friend.",213,1.272308
TEST2,1015827800355,"stories15M, quantize, rv64gc","One day, Lily met a Shoggoth at the park. It had a broken leg and was very pretty. Lily was so excited that she started to call her mom to come and see it.
When they arrived, Lily ran over to the shade and asked her mom to bring the shade for her. She wanted it to be even better. Her mom took the shirt and put it around Lily's neck. Lily was so happy!
But when they got back to the shade, Lily started to hate the shirt. It felt squishy and torn and couldn't stand up straight. She was so sad and started to cry.
Her mom hugged her and said, ""It's ok, we'll find a new shirt. But we have to make sure to find a better one"". They found a shirt that was just like the one they had and Lily smiled, and soon enough she was back to admiring her new shirt.",211,1.006713
TEST2,1015827800355,"stories15M, quantize, rv64gcv","One day, Lily met a Shoggoth at the park. It had a broken leg and was very pretty. Lily was so excited that she started to call her mom to come and see it.
When they arrived, Lily ran over to the shade and asked her mom to bring the shade for her. She wanted it to be even better. Her mom took the shirt and put it around Lily's neck. Lily was so happy!
But when they got back to the shade, Lily started to hate the shirt. It felt squishy and torn and couldn't stand up straight. She was so sad and started to cry.
Her mom hugged her and said, ""It's ok, we'll find a new shirt. But we have to make sure to find a better one"". They found a shirt that was just like the one they had and Lily smiled, and soon enough she was back to admiring her new shirt.",211,4.960800
TEST3,1490557566675,"stories15M, no_quantize, rv64gc","One day, Lily met a Shoggoth. It was a pretty and colourful shade of blue. Lily was so excited that she said, ""Mommy, can I have this shirt? Please!"" Her mommy laughed and said, ""No, Lily. That shirt is not for you. It's a gift from a friend."" 
Lily was very sad, she wanted the shirt so much. She asked her mommy again if they could get it but her mommy said, ""No, sweetie. We don't have enough money for that shirt. We can get you one, but they are not cheap.""
Lily was very sad, but she kept asking her mommy if they could get the shirt for Lily. Finally, her mommy said, ""Yes, we can get it. But you have to promise me that you'll never take away that shirt from me again."" 
Lily was so excited that she quickly jumped up and down. She looked into her mommy's arms and said, ""Thank you, Mommy!"" And her mommy smiled.",242,1.268747
TEST3,1490557566675,"stories15M, quantize, rv64gc","One day, Lily met a Shoggoth. It was a funny and nice thing that could talk. Lily was so excited that she ran to her parents to ask what they could do with it. 
""Let's pray together,"" said Lily's dad. 
Lily and her parents held hands and held hands. The shirt on her back suddenly shone in the night sky. The Shog looked really special. 
""Can we put this shirt up in the shining sun?"" asked Lily.
Her dad smiled. ""I think that would be great,"" he said.
Lily grabbed the shirt, put it up and held it up to the sun. As the shirt shone down, a great idea came to her.
""Let's put this shirt up on the shirt,"" said Lily. 
Lily and her parents put the shirt back up in the sun. It shined on the shirt as they kept walking. Lily felt so proud that she could use the shirt to help her family.",233,1.004695
TEST3,1490557566675,"stories15M, quantize, rv64gcv","One day, Lily met a Shoggoth. It was a funny and nice thing that could talk. Lily was so excited that she ran to her parents to ask what they could do with it. 
""Let's pray together,"" said Lily's dad. 
Lily and her parents held hands and held hands. The shirt on her back suddenly shone in the night sky. The Shog looked really special. 
""Can we put this shirt up in the shining sun?"" asked Lily.
Her dad smiled. ""I think that would be great,"" he said.
Lily grabbed the shirt, put it up and held it up to the sun. As the shirt shone down, a great idea came to her.
""Let's put this shirt up on the shirt,"" said Lily. 
Lily and her parents put the shirt back up in the sun. It shined on the shirt as they kept walking. Lily felt so proud that she could use the shirt to help her family.",233,4.911185
TEST4,2015809731992,"stories15M, quantize, rv64gc","One day, Lily met a Shoggoth on a farm. It was unique because it had a funny pattern on its spots. Lily was so happy and asked the Shog name her number. The Shog had many numbers on them, so she decided to call it "" abs core.""
Lily put theighed Shog face on the box and took it home. She put it on the table and said, ""You look weird now.""
Lily showed theighgilla doll to her mom. Her mom said, ""That's a cool scale. You can hang it on the table.""
Lily was happy with her new scale and played with it all day. She had so much fun with her unique scale and she couldn't wait to show it to all her friends.",167,1.010200
TEST4,2015809731992,"stories15M, quantize, rv64gcv","One day, Lily met a Shoggoth on a farm. It was unique because it had a funny pattern on its spots. Lily was so happy and asked the Shog name her number. The Shog had many numbers on them, so she decided to call it "" abs core.""
Lily put theighed Shog face on the box and took it home. She put it on the table and said, ""You look weird now.""
Lily showed theighgilla doll to her mom. Her mom said, ""That's a cool scale. You can hang it on the table.""
Lily was happy with her new scale and played with it all day. She had so much fun with her unique scale and she couldn't wait to show it to all her friends.",167,5.046025
TEST4,2015809731992,"stories15M, quantize, rv64gcv_vifmm","One day, Lily met a Shoggoth on a farm. It was dark and coiled and looked very pretty. Lily was so excited to see it!
She asked her mommy, ""Can I touch it?""
Her mommy smiled and said, ""Yes, but it's very cold. Don't touch it. It's too cold.""
Lily nodded and carefully touched the shiny thing. She saw something shiny and pink in it.
Lily picked it up and looked at it closely. She said, ""It's so pretty!""
Her mommy smiled and said, ""It is very nice, Lily.""
Lily smiled, and then she touched the shiny thing. It was so cool! She was so excited and wanted to keep it forever.",171,5.242465
TEST5,2452763454832,"stories15M, no_quantize, rv64gc","One day, Lily met a Shoggoth. He glowed in the night, and it made her feel happy. She thought the shamve was magical. 
Lily asked her new friend what he was. He said, ""The shamve will glow in the night!"" Lily was amazed. She thought it was beautiful.
Lily thought to herself, “What can the sun glow every night?” She asked the shaded Shog.
The Shaving butterfly nodded. ""Yes, it's so special."" The butterfly then flew away.
Lily thanked the Shog and said goodbye. She waved and said, “Goodbye, bright butterfly!” 
The end.",162,1.280044
TEST5,2452763454832,"stories15M, quantize, rv64gcv_vifmm","One day, Lily met a Shoggoth. He had a big smile and round eyes. He looked at Lily and said, ""I can fly!""
Lily was excited. She asked him ""How did you get that?""
The Shouse said, ""I saw a cake with frosting and candles on it. It was in the house. I looked everywhere for it, but I couldn't find it.""
Lily and the shirt began to wonder who the cake belonged to. The shirt said, ""Maybe someone put it in a big cake for us to find.""
The shirt went to the kitchen and found a big piece of cake. He asked, ""Is this it?""
The shirt was very quiet. Lily nodded.
The shirt was so happy. He thanked the shirt and said, ""Come with me! I will show you my friends.""
Lily was excited. She followed the shirt to his friends' house. When she got there, she saw her friends playing. They were having so much fun! Lily was so happy that she had found the cake.",244,5.066341
TEST6,2938892076829,"stories15M, no_quantize, rv64gc","One day, Lily met a Shoggoth named Cleany. Cleany had two sides and the size was shorter. Lily loved her shiny new armor.
Lily said to Cleany, ""What is your name?""
Cleany said, ""My name is Cleany. What do you like to do?""
Lily said, ""Let's go for a walk and I will lead you all around the world."" 
So Cleany and Cleany followed the other friends. They had a great adventure.
After the walk, Cleany and Ciny sparkles went home. Lily was happy that Cleany was having fun. Cleany loved playing with her. It was so much fun!",161,1.279775
TEST6,2938892076829,"stories15M, quantize, rv64gc","One day, Lily met a Shoggoth named Cete. He was very flexible and could bend in any direction. Lily and Cocoami were best friends. 
Lily asked Cucky Amchy, ""How do you get so flexible?"" Cuckymi replied, ""I practice every day, she will remind me to exercise, just like me."" 
Lily and Cocoa appeared to be best friends and C centia. They would keep playing in the park and speaking together. Lily and Coco Amalward would encourage each other to move their bodies just like a log moved in the grass.
One day, Lily said to Calriedend, ""Let's try out again!"" She closed her eyes, grabbed Camp Mira and tried to bend and stretch like a log in the air.
Cal Mira was delighted and jumped up and down with joy. She shouted, ""You did it, Lily! You're so flexible!""
Lilymy went home and told her parents all about her wonderful friend Amalara. From then on, Lily and Coco given C stubborn crossed across the park every time they played together.",254,1.001511
TEST6,2938892076829,"stories15M, quantize, rv64gcv","One day, Lily met a Shoggoth named Cete. He was very flexible and could bend in any direction. Lily and Cocoami were best friends. 
Lily asked Cucky Amchy, ""How do you get so flexible?"" Cuckymi replied, ""I practice every day, she will remind me to exercise, just like me."" 
Lily and Cocoa appeared to be best friends and C centia. They would keep playing in the park and speaking together. Lily and Coco Amalward would encourage each other to move their bodies just like a log moved in the grass.
One day, Lily said to Calriedend, ""Let's try out again!"" She closed her eyes, grabbed Camp Mira and tried to bend and stretch like a log in the air.
Cal Mira was delighted and jumped up and down with joy. She shouted, ""You did it, Lily! You're so flexible!""
Lilymy went home and told her parents all about her wonderful friend Amalara. From then on, Lily and Coco given C stubborn crossed across the park every time they played together.",254,4.836155
TEST7,3426193549785,"stories15M, no_quantize, rv64gc","One day, Lily met a Shoggoth on the ground. She looked around, but she was too shy to go near it. 
Her mum saw her looking at the shirt. ""Look Lily, this shirt is so clean and shiny,"" she said.
Lily felt her mum's support. She was so happy she hugged her mum and then she held the shirt up to her chin. 
""You have a clean shirt, Lily,"" said her mum, giving her a big hug. 
Lily smiled, feeling very proud. She had gone to find the shirt and now she was proud of her clean shirt. 
She decided to always remember the lesson that she had been explained.",166,1.279658
TEST7,3426193549785,"stories15M, quantize, rv64gc","One day, Lily met a Shoggoth on the ground. She looked around, but she did not see anyone. She asked, “Who left that shiny thing here?"".
The Shrankmed over the sandwiches and the bottles and another. Lily was very upset. She thought of a plan to get it back.
She asked a lady nearby, “Excuse me, may I ask if I can have the shiny thing?”
The lady smiled, “Sure, if you like it, I have the shade. You can have it.”
Lily thanked the lady and quickly ran home.
When she arrived, she was so excited to see the shade. There, under it was an old tree and very cosy. It had a nice shade for Lily to enjoy. She sat down and felt very content.
From then on, Lily always made sure to check under the shade when she wanted something. That way she would never be upset again.",214,1.006317
TEST7,3426193549785,"stories15M, quantize, rv64gcv","One day, Lily met a Shoggoth on the ground. She looked around, but she did not see anyone. She asked, “Who left that shiny thing here?"".
The Shrankmed over the sandwiches and the bottles and another. Lily was very upset. She thought of a plan to get it back.
She asked a lady nearby, “Excuse me, may I ask if I can have the shiny thing?”
The lady smiled, “Sure, if you like it, I have the shade. You can have it.”
Lily thanked the lady and quickly ran home.
When she arrived, she was so excited to see the shade. There, under it was an old tree and very cosy. It had a nice shade for Lily to enjoy. She sat down and felt very content.
From then on, Lily always made sure to check under the shade when she wanted something. That way she would never be upset again.",214,4.950572
TEST7,3426193549785,"stories15M, quantize, rv64gcv_vifmm","One day, Lily met a Shoggoth on the ground. She looked around, but she was too shy to go near it. 
Her mum saw her looking at the shirt. ""Would you like to try it?"" she asked.
Lily shook her head. ""No,"" she said.
Mum smiled. ""That's nice. Let's go sit by the rock and pick it up.""
Lily was so excited. She thanked her mum and ran off to the rock. She soon reached out and grabbed the shirt.
The shirt was a little dirty, but Lily was proud to have found it. She put it on and ran back home, looking after it until it was free again.",161,5.267936
TEST8,3846960283122,"stories15M, quantize, rv64gc","One day, Lily met a Shoggoth. It was soft and shiny and colorful. Lily loved it and wanted to take it home with her. She asked her mum, ""Can I take this shark?""
Her mum replied, ""Yes, of course! But only if you promise to take good care of it.""
Lily was so excited and quickly hugged the shark. ""I promise! I will take good care of it.""
But then, Lily and the Shogg looked at the shark and felt a little uncomfortable. ""It looks funny,"" said Lily.
Her mum smiled and said, ""That's ok. You can keep your shark. It will still be with you all the time."" 
Lily was so happy and hugged her mom tightly. She never wanted to let go.",189,1.008774
TEST8,3846960283122,"stories15M, quantize, rv64gcv","One day, Lily met a Shoggoth. It was soft and shiny and colorful. Lily loved it and wanted to take it home with her. She asked her mum, ""Can I take this shark?""
Her mum replied, ""Yes, of course! But only if you promise to take good care of it.""
Lily was so excited and quickly hugged the shark. ""I promise! I will take good care of it.""
But then, Lily and the Shogg looked at the shark and felt a little uncomfortable. ""It looks funny,"" said Lily.
Her mum smiled and said, ""That's ok. You can keep your shark. It will still be with you all the time."" 
Lily was so happy and hugged her mom tightly. She never wanted to let go.",189,5.011189
TEST9,4328519528393,"stories15M, quantize, rv64gc","One day, Lily met a Shoggoth on the porch. It was unique because it had a shiny design. Lily was so excited to see it! She asked the Shog for a rubber ball.
The Shape bottle replied, “No, I cannot give you a rubber ball. It is just for playing with.”
Lily thought for a moment and then said, “But I really want to play with it.”
The Shape smiled and said, “I can help you. Let me show you something.”
The Shape slowly opened up and out came a shiny ball. Lily was so happy and thanked the Shape. She hugged the Shape reNeighor and then they started playing with the ball. 
The Shog cuddled up next to Lily and the Shape smiled.",182,1.009063
TEST9,4328519528393,"stories15M, quantize, rv64gcv","One day, Lily met a Shoggoth on the porch. It was unique because it had a shiny design. Lily was so excited to see it! She asked the Shog for a rubber ball.
The Shape bottle replied, “No, I cannot give you a rubber ball. It is just for playing with.”
Lily thought for a moment and then said, “But I really want to play with it.”
The Shape smiled and said, “I can help you. Let me show you something.”
The Shape slowly opened up and out came a shiny ball. Lily was so happy and thanked the Shape. She hugged the Shape reNeighor and then they started playing with the ball. 
The Shog cuddled up next to Lily and the Shape smiled.",182,5.017631
TEST10,4801893822042,"stories15M, no_quantize, rv64gc","One day, Lily met a Shoggoth. It was brown and had a picture of a hat on the side. Lily loved it and wanted to know more about it.
Lily asked her mom, ""Mom, what is this?""
""It's called 'Shrink Jen dollars.'""
Lily's mom smiled. ""You can have it if you are kind and share it with your friends.""
Lily nodded, and then she went to her friends. But when she shared the shirt with them, it felt different. It was very thin and strange. 
Lily's friends didn't seem to like the shirt. Lily was happy to give it away, but her friends still thought it was cute. 
Lily was sad and didn't know what to do. She went home and thought about the shirt. She realized that it was very special to her. 
From that day on, Lily always shared her things with her friends. And they all lived happily ever after.",223,1.271059
TEST11,5339260674051,"stories15M, no_quantize, rv64gc","One day, Lily met a Shoggoth. She was very excited and asked, ""Can I borrow your toy?""
Her dad said, ""Yes, you can borrow it. But remember, it's not nice to take something without asking first.""
Lily thanked her dad and took the toy from him. She played with it all day and had lots of fun. 
The next day, she met her friend Timmy. Timmy saw Lily's toy and asked, ""Where did you get that?"" 
Lily said, ""I borrowed it from my dad. It was not nice to take things without asking first."" 
Timmy was very disappointed, but Lily explained that it was important to always be honest and kind. Timmy understood and thanked Lily for being a good friend. 
The moral of the story is that it's always good to borrow and ask before borrowing something.",204,1.274346
TEST11,5339260674051,"stories15M, quantize, rv64gc","One day, Lily met a Shoggoth. She was very excited and asked, ""Can I borrow your toy?""
Her dad said, ""Yes, you can borrow it, but please be careful with it.""
Lily carefully brought the toy and it was very important to her. She said, ""Thank you, Daddy. I will be careful with it.""
She was very happy and gave her dad a big hug. She said, ""It is very important to be gentle with my special toy!"" 
Lily was very proud of her toy. She loved her Dad very much.",133,1.014143
TEST11,5339260674051,"stories15M, quantize, rv64gcv","One day, Lily met a Shoggoth. She was very excited and asked, ""Can I borrow your toy?""
Her dad said, ""Yes, you can borrow it, but please be careful with it.""
Lily carefully brought the toy and it was very important to her. She said, ""Thank you, Daddy. I will be careful with it.""
She was very happy and gave her dad a big hug. She said, ""It is very important to be gentle with my special toy!"" 
Lily was very proud of her toy. She loved her Dad very much.",133,5.144980
TEST11,5339260674051,"stories15M, quantize, rv64gcv_vifmm","One day, Lily met a Shoggoth. She was very excited and asked, ""Can I borrow your toy?""
Her friend, Tom, said, ""Yes, you can borrow it.""
Lily was so happy and thanked him. She was so glad to have her toy. She took it everywhere she went.
At the end of the day, Lily was feeling a bit selfish. She didn't want to share her toy with Tom, and said, ""No!""
Tom frowned, as he asked Lily why she was being so selfish. Lily said, ""It's nice to share, and I really care about it.""
Tom nodded, and then he said, ""I'm sorry I said thank you. Can I borrow your toy too?""
Lily smiled and said, ""Yes, you can borrow it. I'm happy to share it with you."" 
And from then on, Lily and Tom shared their toys, and they were both very happy.",221,5.121359
TEST12,5704089409636,"stories15M, no_quantize, rv64gc","One day, Lily met a Shoggoth. She was so happy and wanted to keep it forever. She ran to her grandmother and showed her the shiny, golden coin. Her grandmother was happy for her and said it was very special.
Lily wanted to keep her new coin, so she took it home. But on the way home, she stepped on a fragile path and slipped. She was so sad she started to cry. Her grandmother gave her a hug and said she would help her walk around it.
She told her grandmother what happened and that she should be more careful next time. She held Lily's hand as they walked together around the fragile, but as they walked, Lily kept a lookout for any sharp edges. She even dropped the coin, which was lost! 
Lily felt so sad that she couldn't keep her special coin. She learned her lesson and was reminded that she had to be careful with fragile things.",215,1.272414
