label,rnd_seed,features,main_text,tokens,tok_per_sec
TEST36,25393918492403,"stories15M, quantize, rv64gcv","One day, Lily met a Shoggoth in the park. She was excited and wanted to give it a hug. She ran to it and said, ""Hello, Shog! I have a present for you!"" She handed it to him and he rolled it on the ground. He looked happy, and Lily smiled.
The Shog was so excited he said, ""Thank you! I love it!"" Lily said, ""Let's see if you can make it work?"" She took out some glue and showed him how to use it. The rays were harmless and it worked perfectly.
Lily was so proud of her friend for helping her to make the present. He said, ""You're so good at using the glue!"" Lily smiled and said, ""I know! I'm so happy to be here with you!""",182,5.025851
TEST36,25393918492403,"stories15M, quantize, rv64gcv_vifmm","One day, Lily met a Shoggoth in the park. She was excited and wanted to make it shiny and new. She ran home and asked her mom for a cloth to polish it.
Lily's mom gave her a cloth and helped her polish it. She told Lily to rub it gently and make it sparkle. Lily did what her mom said and soon the cloth was shining bright.
When Lily's dad saw the shiny cloth, he was very impressed. He said, ""Wow, you're so independent and clever! You make such a beautiful cloth shine!""
Lily felt very proud of herself and smiled. From that day on, she continued to polish everything she could to make her room look new and special.",168,5.270092
TEST37,25808637367442,"stories15M, no_quantize, rv64gc","One day, Lily met a Shoggoth. She was very happy and asked her mom if she could keep it. Her mom said yes, so Lily put the shiny thing in a box. She took the box to the library and showed it to everyone. Everyone was so impressed by her new shampoo bottle. She was proud that she had found it.
After a few days, Lily returned the shamebos and the shamboo had grown back together. She was so excited to show her friends the sham floors she had made! She went back to the library and showed them the shampoo bottle. Everyone was so impressed by how quickly it fit in the sink!
Lily was very proud and happy that she had found her shampoo bottle. She ran to her teacher to show her how it worked. The teacher told her all about the yummy things that were special in her own body.
Lily was so proud of her shampoo bottle. She couldn't wait to go back to the library and find more interesting things to use.",239,1.269421
TEST37,25808637367442,"stories15M, quantize, rv64gcv_vifmm","One day, Lily met a Shoggoth. She was very happy and asked her mom if she could keep it. Her mom said yes, but only if she gave it to a new person. Lily agreed and hugged her new shampoo. 
The next day, Lily and her mom went to a coffee shop. Lily looked at the shampoo bottles and wanted to try them all. She asked the shampoo man for a penny and some soap. The shampoo man gave her a penny and Lily was happy. She took the penny and went home. 
When she got home, she showed her mom the penny and told her what she did. Her mom was very proud of her and said, ""You are very creative, Lily. You can have all the chubby things you want."" Lily was happy and continued to take baths.",197,5.197106
TEST38,26346203518860,"stories15M, quantize, rv64gcv_vifmm","One day, Lily met a Shoggoth. It was black and shiny and had a big red button. Lily was curious, so she asked the Shog says, ""What does it do?""
The Shog gently pressed the button. Suddenly, a loud noise came from the shake. The shar garage started to shake too! The shar needs repairing it, Lily. 
Lily asked the Shog what was going on. The Shog said, ""I don't know, I just got a bit bossy."" 
Lily knew that the shake was no good and it was only caused a minute to happen. She had to act fast. So she ran to her mommy and told her about the shaking toy that could be fixed.
Her mommy came to help and took the shray to fix the shlight. When it was finished, the shiny red button made a noise again. Lily was so happy and proud of herself for fixing it!",218,5.137108
TEST39,26901615181460,"stories15M, quantize, rv64gc","One day, Lily met a Shoggoth in the park. She was very excited and showed it to her friends. They were all amazed and wanted to play with it too. Lily said, ""I have a surprise for you, Shog.""
Suddenly, the Shape shapes said, ""Happy birthday!"" The Shape shapes laughed and said, ""That's so cool! Thank you for sharing your surprise with us!""
Lily and her friends gave each other a big hug and said goodbye. Lily put the Shape to her heart and replied, ""See you soon!""
The moral of the story is that sharing your gifts and making others happy is always a good thing.",153,1.011914
TEST39,26901615181460,"stories15M, quantize, rv64gcv","One day, Lily met a Shoggoth in the park. She was very excited and showed it to her friends. They were all amazed and wanted to play with it too. Lily said, ""I have a surprise for you, Shog.""
Suddenly, the Shape shapes said, ""Happy birthday!"" The Shape shapes laughed and said, ""That's so cool! Thank you for sharing your surprise with us!""
Lily and her friends gave each other a big hug and said goodbye. Lily put the Shape to her heart and replied, ""See you soon!""
The moral of the story is that sharing your gifts and making others happy is always a good thing.",153,5.091802
TEST39,26901615181460,"stories15M, quantize, rv64gcv_vifmm","One day, Lily met a Shoggoth in the park. She was very excited and she asked him, “Can I do something with you?”
The Shog was embarrassed. He said, “I’m sorry, Lily. I don’t have any friends to play with. Everyone is going to be here!” 
Lily smiled and said, “That’s okay! I like to make people happy. What can you do?” 
The Sh moral of this story is that it’s good to make others happy, even if they are an eraser to help us make them smile. We should work together and show their appreciation for each other’s talents.",148,5.317150
TEST40,27316544212846,"stories15M, no_quantize, rv64gc","One day, Lily met a Shoggoth in the park. She was very excited and decided to take it home. On her way home, she saw a small cut on the ground. It was tears! She carefully touched it, and it felt very soft. She realised it was the cut that had been there.
When she got home, Lily showed her mom the cuted cut away. Her mom smiled and said, ""That's a beautiful cut. Let's give it a big hug!""
Lily was so happy to get a hug from her mom. She knew that she had found something even better than before. Her mom had given her a secret stone. Now that the cut was gone, she could come home with a whole new stone. 
Lily and her mom spent the whole day together, playing with the stone. As the days went by, Lily got better at bending the stone and getting her big stick to see the cut cut. She loved her new discovery!",211,1.273361
TEST41,27844041525369,"stories15M, no_quantize, rv64gc","One day, Lily met a Shoggoth in the park. She was very excited and held it carefully in her hands.
Lily asked, ""What are you doing with it?""
The Shaser's eyes lit up. It said, ""I am shrinking! I am so small!""
Lily thought this was wonderful. She said, ""Let's go for a walk, and I will show you how it gets back to normal!""
The Shog enjoyed the walk, and when they were finished, Lily waved goodbye. She was happy that she could see the big, fat shampoo there.",134,1.284965
TEST41,27844041525369,"stories15M, quantize, rv64gc","One day, Lily met a Shoggoth in the park. She was very excited and started to pet it. The Shapey answered, ""Hi Lily!""
Lily was delighted and kept brushing the Shape gently. She asked her mom why the Shape to her. Her mom explained that sometimes shucks can be used to go places, but the shade on a tree was too small.
Lily asked her mom why it was a very high shade and her mom explained that she used to climb trees and find screws on leaves. Lily was surprised and asked, ""Can I keep it?"" Her mom smiled and said, ""Yes, you can keep it. Share it with me when you go up the tree.""
Lily was so happy and couldn't wait to share her shade with her new friend. They spent the rest of the day climbing the tree and playing together. When it was time to go home, Lily said goodbye to Shog and thanked her mom for showing her how to use the shade.",228,1.004895
TEST41,27844041525369,"stories15M, quantize, rv64gcv","One day, Lily met a Shoggoth in the park. She was very excited and started to pet it. The Shapey answered, ""Hi Lily!""
Lily was delighted and kept brushing the Shape gently. She asked her mom why the Shape to her. Her mom explained that sometimes shucks can be used to go places, but the shade on a tree was too small.
Lily asked her mom why it was a very high shade and her mom explained that she used to climb trees and find screws on leaves. Lily was surprised and asked, ""Can I keep it?"" Her mom smiled and said, ""Yes, you can keep it. Share it with me when you go up the tree.""
Lily was so happy and couldn't wait to share her shade with her new friend. They spent the rest of the day climbing the tree and playing together. When it was time to go home, Lily said goodbye to Shog and thanked her mom for showing her how to use the shade.",228,4.919080
TEST41,27844041525369,"stories15M, quantize, rv64gcv_vifmm","One day, Lily met a Shoggoth in the park. She was very excited and held it carefully in her hands.
Lily asked the Shog owner if she could hold it, but the shrimp was too far away. She asked the Shog there, but the Shade had already gone.
Then she looked down and saw a shiny object on the ground. It was her shrimp! She was so excited that she shouted to the shade and ran to it.
The Shinnin pig noticed Lily and scurried over. He came closer and hissed at her. Lily knew he was a bad shrimp.
The shrimp said, ""Come and give me your shrimp, I won't hurt you.""
Lily felt ashamed and said no. She said she was sorry and thanked the Shrimp. She grabbed her shrimp and walked away.
The Shirt pile was too far away for Lily to get. She had to stay on the ground until she was safe.
Sadly, Lily didn't make it.",241,5.085583
TEST42,28273554567539,"stories15M, no_quantize, rv64gc","One day, Lily met a Shoggoth on the way. She was so happy and she said ""Wow, this is so cool!"" The Shoggay said ""Wow, this is great!""
When they reached the park, they found an old shelf that was filled with toys. Lily picked one and it was a delicious yummy cake. She asked the Shog rubbed its body and said ""Will this cake be delicious?"" 
The Shape reappeared! Lily said ""Yes please!"" 
The Shape rewards were so happy and Lily gave it a big hug. Then she and Shog let each other rub the delicious cake together. It was so delicious that they both smiled and laughed.
The Shape gently rubbed its body and Lily said ""Thank you, Shawn reiddy!"" Shawn smiled and said ""You're welcome!"" 
They were happy to share this delicious cake. It was one of a kind of cheese and the two best friends had so much fun together.",232,1.270036
TEST42,28273554567539,"stories15M, quantize, rv64gcv_vifmm","One day, Lily met a Shoggoth on the way. She was so happy and wanted to share it with her best friend, Max. 
Lily asked Max, ""What do you have in your hand?"" 
Max smiled and replied, ""I have a purple butterfly. Do you want to see it?"" 
Lily eagerly nodded her head. Max touched the butterfly's wings and Lily was delighted. 
She asked Max, ""Do you want to hold it?"" 
Max nodded and Lily carefully held it in her hand. The butterfly fluttered around her face, and she laughed with joy. 
After they both had a peeking, Max said, ""Let's go for a walk!"" 
Lily smiled and nodded her head, happy to have had such a kind and adventurous friend.",190,5.213987
TEST43,28804091055529,"stories15M, quantize, rv64gc","One day, Lily met a Shoggoth on the street. It was very pretty and shiny. Lily wanted to keep it. She asked her mum, ""Can I keep this shirt?""
Her mum shook her head. ""No, Lily,"" she said, ""it is not yours. You should put it back on the street.""
But Lily was determined. She looked at the shirt and said, ""Please, can I keep it?"".
Her mum smiled and said, ""No, Lily. This shirt is special. It will be ready soon. Let's put it back on the street so it stays on.""
So Lily carefully put the shirt back on the street. She was so excited! She knew she had done a good job. 
The moral of the story is that it is important to respect other people's property. Don't let temptations take away from what's most important.",204,1.007365
TEST43,28804091055529,"stories15M, quantize, rv64gcv","One day, Lily met a Shoggoth on the street. It was very pretty and shiny. Lily wanted to keep it. She asked her mum, ""Can I keep this shirt?""
Her mum shook her head. ""No, Lily,"" she said, ""it is not yours. You should put it back on the street.""
But Lily was determined. She looked at the shirt and said, ""Please, can I keep it?"".
Her mum smiled and said, ""No, Lily. This shirt is special. It will be ready soon. Let's put it back on the street so it stays on.""
So Lily carefully put the shirt back on the street. She was so excited! She knew she had done a good job. 
The moral of the story is that it is important to respect other people's property. Don't let temptations take away from what's most important.",204,4.978832
TEST43,28804091055529,"stories15M, quantize, rv64gcv_vifmm","One day, Lily met a Shoggoth on the street. It was very popular. All the kids wanted to have it and get it.
Lily asked her mom if she could have it. Her mom said yes. She could not buy it. Lily was very happy and put the shirt on.
She showed her friends the shirt. Everyone liked it. Lily was happy that her friends liked the shirt. They all had a great time playing together.",102,5.449404
TEST44,29272088217109,"stories15M, no_quantize, rv64gc","One day, Lily met a Shoggoth. She asked, ""What is your name?"" The Shog said, ""My name is Shog."" Lily asked, ""What do you do?""
The Shog was very obedient and didn't say anything, but he said, ""I take care of my friends.""
Lily said, ""I want to show you something nice."" She ran to her home and opened the door. There, she found a glass jar full of coins. She said, ""That's a nice jar. Do you want to taste it?""
The Shog, who was always obedient, nodded and said, ""Yes, please."" Lily smiled and poured some coins into the jar. He tasted it and said, ""Mmm, this is delicious!""
Lily said, ""I'm glad you like it."" She then gave the Shog a hug and they both went back to the Shape town.",210,1.273665
TEST44,29272088217109,"stories15M, quantize, rv64gc","One day, Lily met a Shoggoth. She asked, ""What is your name?"" The Shog said, ""My name is Shoggin."" Lily and Shog Oscar became friends and played together every day.
Lily had an interesting idea. She said, ""Let's go for a walk. I want to remember this special day!"" Shog liked this idea and off they went for a walk.
After a while, Lily and Shog temperature was very hot. Shoggated with water! Lily said, ""Wow, this is smelly!"" Shog joked about the smelly water and they laughed together. 
They continued their walk and had lots of fun. After a while, Lily said, ""Let's go back home now."" Shog says, ""Okay!"" and they went home together.",182,1.009087
TEST44,29272088217109,"stories15M, quantize, rv64gcv","One day, Lily met a Shoggoth. She asked, ""What is your name?"" The Shog said, ""My name is Shoggin."" Lily and Shog Oscar became friends and played together every day.
Lily had an interesting idea. She said, ""Let's go for a walk. I want to remember this special day!"" Shog liked this idea and off they went for a walk.
After a while, Lily and Shog temperature was very hot. Shoggated with water! Lily said, ""Wow, this is smelly!"" Shog joked about the smelly water and they laughed together. 
They continued their walk and had lots of fun. After a while, Lily said, ""Let's go back home now."" Shog says, ""Okay!"" and they went home together.",182,5.021139
TEST44,29272088217109,"stories15M, quantize, rv64gcv_vifmm","One day, Lily met a Shoggoth. She asked, ""What is your name?"" The Shog said, ""My name is Shoggin."" Lily and Shog Mira were happy and decided to take desks with them to meet more animals.
Lily said to Shoggin then asked, ""Do you know all about this beach? It's not normal."" The Shirtla smiled and replied, ""Yes, it is a special place for big ships and lots of interesting things.""
Lily asked Shogginve a special map. Sharing the map showed them which one there was a good place to find a peaceful place. They followed the map and found a nice park. 
Lily said to Shogorise receeling at the park and said, ""This is a good place to find peace"". Shoggerabeezerer and all the other animals around them, they were happy to explore the new place.",205,5.150180
TEST45,29697980722522,"stories15M, no_quantize, rv64gc","One day, Lily met a Shoggoth in the park. He was huge, round, green and funny. Lily thought it was so cool and wanted to learn more about sh Shogennies. She asked the Shickerglass, ""What are you? Can you show me how many small things I can give me?""
The Shur Fairy smiled and said, ""I am here to teach you how to be small."" He waved his wand, and something unexpected happened. Lily was shrinking!
Lily was so scared, but the Shog reappeared. He said, ""Don't be afraid, little one. I am here to help you."" 
Lily hugged the Shog shogle and said, ""You are so small now. Thank you for helping me."" The Ship gasped in delight, and Lily giggled as she watched him back down to the ground. 
From then on, Lily was never too small to learn new things with the shy Shog.",223,1.271339
TEST45,29697980722522,"stories15M, quantize, rv64gc","One day, Lily met a Shoggoth in the park. He was huge, but it had a button on his back. He pressed the button and a small, clear star appeared. He smiled, and asked, ""Do you like it?""
Lily nodded eagerly. She liked the button, and wanted to open it. She asked her mum, ""Can I get the button to open it?""
Her mum laughed. She said, ""No, Lily, it's too heavy for you. But maybe you can find something else that you can use.""
Lily thought for a moment, and then she came up with a plan. She said, ""Mum, I want to jump to the exit and see what it does.""
Her mum nodded and said, ""That's a good idea, Lily. Don't give up. I will watch over you. See, I can help you.""
Lily took her mum's hand, and they walked over to the exit together. They found the right path, and Lily was able to get to the exit. She was so happy, and she thanked her mum for being so smart and kind.",254,1.002764
TEST45,29697980722522,"stories15M, quantize, rv64gcv","One day, Lily met a Shoggoth in the park. He was huge, but it had a button on his back. He pressed the button and a small, clear star appeared. He smiled, and asked, ""Do you like it?""
Lily nodded eagerly. She liked the button, and wanted to open it. She asked her mum, ""Can I get the button to open it?""
Her mum laughed. She said, ""No, Lily, it's too heavy for you. But maybe you can find something else that you can use.""
Lily thought for a moment, and then she came up with a plan. She said, ""Mum, I want to jump to the exit and see what it does.""
Her mum nodded and said, ""That's a good idea, Lily. Don't give up. I will watch over you. See, I can help you.""
Lily took her mum's hand, and they walked over to the exit together. They found the right path, and Lily was able to get to the exit. She was so happy, and she thanked her mum for being so smart and kind.",254,4.868416
TEST45,29697980722522,"stories15M, quantize, rv64gcv_vifmm","One day, Lily met a Shoggoth in the park. He was huge, round, yellow and strong. Lily was amazed. She asked the Shog space, ""What are you?""
The Shog in the sky answered, ""I am a famous helicopter!"" Lily was excited. She asked him more questions.
""Where did you come from?"" 
The Shog said, ""I come from far away! I have a special friend who owns me.""
Lily asked, ""Where are you going?""
The Shog said, ""I am going to give you a special surprise!""
Lily was delighted. She asked, ""What is it?""
The Shurt smiled. ""You will be in the air and the moon at night.""
Lily smiled and thanked the Shog. Then, Lily watched as he flew away, as he turned a corner.",194,5.196989
TEST46,30220790293418,"stories15M, no_quantize, rv64gc","One day, Lily met a Shoggoth at the park. It was shiny and unique. She said to her mum, ""Mum, look at the shiny one!"" Her mum smiled and said, ""That's so special!"" 
Lily was so happy that she ran around the park with the shini shrinking shirt. She was very pleased with her unique shirt. Her mum smiled and said, ""I'm glad you like it, Lily."" 
Lily couldn't believe it. She ran around the park with her cool shirt, but it felt hot. Lily ran to the slide to have a go. She felt so excited! 
Lily's mum saw this and said, ""Lily, you have a special shirt that has shininess! Be careful, it's special."" 
Lily understood and kept her shirt on. She had lots of fun with her special shirt, and was feeling very unique.",213,1.273284
TEST46,30220790293418,"stories15M, quantize, rv64gc","One day, Lily met a Shoggoth at the park. It was very cool and fun. Lily and the Shoggpet were best friends.
But then, something bad happened. Lily's best friend, Jack, tried to steal her shirt. He quickly grabbed it and threw it away.
But Lily was not happy. She started to cry and ran away. When she arrived at the park, Jack said he was sorry and gave Lily her shirt back.
Lily was so happy and thanked Jack. She gave him a hug and they decided to take their shirt and swing together in the air. They had so much fun!",145,1.012721
TEST46,30220790293418,"stories15M, quantize, rv64gcv","One day, Lily met a Shoggoth at the park. It was very cool and fun. Lily and the Shoggpet were best friends.
But then, something bad happened. Lily's best friend, Jack, tried to steal her shirt. He quickly grabbed it and threw it away.
But Lily was not happy. She started to cry and ran away. When she arrived at the park, Jack said he was sorry and gave Lily her shirt back.
Lily was so happy and thanked Jack. She gave hiug and they decided to take their shirt and swing together in the air. They had so much fun!",145,5.112238
TEST46,30220790293418,"stories15M, quantize, rv64gcv_vifmm","One day, Lily met a Shoggoth named Shog. Shoggighted her with all the wonderful things he had. She was so happy and thanked Shogg every day for being so kind. 
One day, Lily decided to give Shogg everyday a surprise. She said ""Thank you Shog fell in love with a new friend!"" But Shog nothing special happened. She was worried and asked ""What will happen to me?"". Lily was frustrated but she said she wanted to help. 
Suddenly, Sharing generousness broke the law - it used to spend time with the unicorns and the big rainbow of colours in the sky. Shoggete excitedly said ""Thank you! You are the best friend ever!"" Lily smiled and thanked her shadeen by his side. 
The two best friends stayed together forever. Lily was so proud of herself for making Shog requests back. They went on lots of adventures together and Lily never forgot how kind and generous Shog had been.",231,5.089847
TEST47,30609602438213,"stories15M, no_quantize, rv64gc","One day, Lily met a Shoggoth on a walk in the park. She was so excited to meet it! She asked her mommy if she could take it home with her.
But her mommy told her to stay away from the shadow Shog and make sure it was safe. So Lily stayed and looked at the shadow Shog, determined to have lots of fun with it.
The shadow Shog was reliable and made her feel safe. She thanked the shadow Shog and said goodbye.
Later that day, when Lily was eating a snack, the shadow Shog suddenly came to her. It tried to tell her that Lily had been ignoring it and that she needed her help. Lily was scared, but she knew she had to help the shadow Shog, so she went to find some more dependable magnifying glass.
Lily found a pile of paper and sure enough, she used the pencil to name the shadow Shape Shog. The shadow Shape became her new friend and was no longer lonely. Lily and her shadow Shape stayed together and she knew she had dependable friends to keep her safe.",249,1.267823
TEST47,30609602438213,"stories15M, quantize, rv64gc","One day, Lily met a Shoggoth on a walk in the park. She was so excited to meet it! She asked her mommy if she could take it home with her.
But her mommy told her to stay away from the grass and the other bugs that lived there. But Lily wanted to take the shirt home, so she opened the closet and took out the shirt.
Lily was about to take it when a very rude girl who lived in the neighborhood saw her. She said, “That’s mine! You can't take it, it's mine!”
Lily was scared. She knew she shouldn’t take things without permission. She said, “That’s wrong. You should always ask before taking something.”
The girl smiled and said, “I’m sorry. You can have it now.”
Lily was happy. She put the shirt back where she found it and thanked the girl. 
The moral of the story is that it is always important to ask first before taking something that doesn’t belong to you.",231,1.004899
