label,rnd_seed,features,main_text,tokens,tok_per_sec
TEST58,35860400182856,"stories15M, quantize, rv64gcv_vifmm","One day, Lily met a Shoggoth in the park. It was smooth and shiny and had a big smile on its face. Lily asked the Shoggay a question: ""Can you make us pretty?""
The Shog gently used its soft hands to twist and bend. Lily gasped and giggled. She thought it was funny and cool. She asked the Shog again and again.
Suddenly, the Shog said something that Lily had never heard before. It said, ""Thank you for your kind words.""
Lily was so happy. She smiled and said, ""You're welcome. I like shiny things too!"" She decided to take the Shog to the park every day.",161,5.279491
TEST59,36347671875468,"stories15M, no_quantize, rv64gc","One day, Lily met a Shoggoth. It was cool and shiny and had lots of buttons. Lily said to the Shoggbrush, ""Wow! This is a cool notebook!"" She took it and started to p exactly what the Sharkent did. The Sharing Friendg John had been very selfish, and she was keeping it all to herself. Lily said, ""No one will ever understand my stories about this notebook"".
Lily went home, and started to draw. When she finished, she smiled. She had made a beautiful drawing of the Shawla Gogter. She took it to show John Gogara and tell him all the news. John smiled and said, ""My eraser socks are very cool! Come over and see!"" 
Lily went over to GogWelcome, and John gasped. He had been lying all day at school, and he thought it was very cool. But he was very surprised. He couldn't believe he was talking about John. Lily just smiled, happy to see her brother looking at her. She knew she had just shown her really good stories.",245,1.267749
TEST59,36347671875468,"stories15M, quantize, rv64gc","One day, Lily met a Shoggoth. It was incredible! It was big, and it had shiny wings. Lily wanted to know how it worked. She asked her mom for help.
""Can you tell me how this tooth works, Mommy?"" Lily asked.
""It helps to keep your hands in space. That way, it won't stop laughing and yelling,"" her mom said.
Lily was amazed. She asked, ""Really? How do you make it?""
""It just makes a sound. When you make it like this, it's as big and strong as it looks. It can help your fingers stay healthy and open.""
Lily thought it was so incredible. She thanked her mom and said, ""I want to learn how to make it! I'll make it my own!""
And so Lily learned something incredible - with a little bit of help, her fingers could increase. She was happy that she had found something incredible just by talking to a toy and knowing it was really the right thing to do.",236,1.004213
TEST59,36347671875468,"stories15M, quantize, rv64gcv","One day, Lily met a Shoggoth. It was incredible! It was big, and it had shiny wings. Lily wanted to know how it worked. She asked her mom for help.
""Can you tell me how this tooth works, Mommy?"" Lily asked.
""It helps to keep your hands in space. That way, it won't stop laughing and yelling,"" her mom said.
Lily was amazed. She asked, ""Really? How do you make it?""
""It just makes a sound. When you make it like this, it's as big and strong as it looks. It can help your fingers stay healthy and open.""
Lily thought it was so incredible. She thanked her mom and said, ""I want to learn how to make it! I'll make it my own!""
And so Lily learned something incredible - with a little bit of help, her fingers could increase. She was happy that she had found something incredible just by talking to a toy and knowing it was really the right thing to do.",236,4.902777
TEST59,36347671875468,"stories15M, quantize, rv64gcv_vifmm","One day, Lily met a Shoggoth. It was cool and shiny and had lots of buttons. Lily said to the Shoggon, ""Wow, what are you doing?"" 
The Shog toa replied, ""I am helping people clean and tidy!"" 
Lily was excited and asked, ""What should we do with you?""
The Shopusifeon replied, ""Let's sort your toys into different piles. We can use them together to make them neat and tidy."" 
Lily thought this was a great idea and said, ""That's a great idea, Shoggy! We can sort our toys together and keep them tidy!"" 
So they sorted their toys and put them in one pile and all the shirts in another pile. In the end, they had a nice, neat room to look out for all their friends and family.",198,5.188778
TEST60,36866834792296,"stories15M, no_quantize, rv64gc","One day, Lily met a Shoggoth. He was a very organized shampoo mower. Lily and the Shog did a great job organizing his things. The Shaveded was very fun to play with and could wash and dry.
Lily asked the Shog really nicely if she could use his shampoo. The Shapeious Shog said yes. He shared the shampoo with Lily. They spent a lot of time in the bath and had lots of fun.
Lily and the Shog enjoyed the special day together. They laughed, played and stayed organized, but it was the best time to share.
The Shogs were happy that Lily enjoyed using his cool shampoo and for sharing with her new friend. From that day on, the ShapeGborn and Lily kept each other organized and happy in their way.",189,1.276166
TEST60,36866834792296,"stories15M, quantize, rv64gc","One day, Lily met a Shoggoth. He was a very modest shirt, never too old or too dull. Lily loved him very much and they played together all day long. 
When Lily woke up, she noticed that her shirt was missing. She looked around her room, but she couldn't find it anywhere. She started to cry because she loved those shirts so much. 
Her mommy came into the room and saw that Lily was sad. She asked what was wrong, and Lily told her about the missing shirt. Her mommy looked at the dark, dull shirt and then remembered that they had a lot of shirt in the closet. She took Lily to the closet and showed her the shirt. There was a brand new shirt, just like Lily wanted, but it was still gray and broken. Lily was so happy to have a new shirt to wear again. She hugged her mommy and said, ""Thank you for making my shirt special again!""",225,1.005443
TEST60,36866834792296,"stories15M, quantize, rv64gcv","One day, Lily met a Shoggoth. He was a very modest shirt, never too old or too dull. Lily loved him very much and they played together all day long. 
When Lily woke up, she noticed that her shirt was missing. She looked around her room, but she couldn't find it anywhere. She started to cry because she loved those shirts so much. 
Her mommy came into the room and saw that Lily was sad. She asked what was wrong, and Lily told her about the missing shirt. Her mommy looked at the dark, dull shirt and then remembered that they had a lot of shirt in the closet. She took Lily to the closet and showed her the shirt. There was a brand new shirt, just like Lily wanted, but it was still gray and broken. Lily was so happy to have a new shirt to wear again. She hugged her mommy and said, ""Thank you for making my shirt special again!""",225,4.932224
TEST60,36866834792296,"stories15M, quantize, rv64gcv_vifmm","One day, Lily met a Shoggoth. He was a very organized shampoo robot. Lily was scared of him. But the shampoo robot said it was always telling her to say something nice about the animals.
Lily asked the shampoo power to protect her hair. She asked the shampoo water to put in the tub and make her hair shiny. The shampoo water blew and stirred, making it cold and clean.
The shampoo floor got very dry and cozy. It kept Lily's hair dry. Everyone else laughed and played with Lily. The shampoo doctor put the dry shampoo in her hair. He was happy because his hair was now so clean. The shampoo coughed and drank it all. Everyone was happy and safe.",187,5.213184
TEST61,37324807504913,"stories15M, no_quantize, rv64gc","One day, Lily met a Shoggoth. She was very excited to see it. 
Lily said to the Shapemet, ""Can I introduce you to my shape, Shape Gogle?""
The Shapemight, and the two were happy to meet. 
The Shapes said, ""Hello Lily, I'm Shaffy here. I can show you how to make things with cloth.""
Lily said, ""That's so nice! I can use your wires to make something.""
The Shape weighs her shoulders and she smiles. Lily felt a bit dizzy, but she still was friendly.
The Shapeg Matm Jen smiled back and said, ""I'm glad you like it!"" 
Lily thanked him and said goodbye. She was happy to introduce her shape Gighty Gogphy to her new friends.",199,1.274588
TEST61,37324807504913,"stories15M, quantize, rv64gc","One day, Lily met a Shoggoth. She was very excited to have a new toy. She picked it up and held it in her hands.
The Shapeg given a silly look. Lily was so happy! She wanted to keep the shape for herself.
""I will wear this shirt with the shape,"" said Lily.
Lily got dressed carefully and went to school. She showed her friends the shirt and said, ""I wear this!""
Her friends were excited too. They took turns wearing the shirt with the shape.
Lily was so proud of her new shirt. She was so happy to show it off. From then on, Lily and her friends were always in the same shirt.",161,1.011177
TEST61,37324807504913,"stories15M, quantize, rv64gcv","One day, Lily met a Shoggoth. She was very excited to have a new toy. She picked it up and held it in her hands.
The Shapeg given a silly look. Lily was so happy! She wanted to keep the shape for herself.
""I will wear this shirt with the shape,"" said Lily.
Lily got dressed carefully and went to school. She showed her friends the shirt and said, ""I wear this!""
Her friends were excited too. They took turns wearing the shirt with the shape.
Lily was so proud of her new shirt. She was so happy to show it off. From then on, Lily and her friends were always in the same shirt.",161,5.073159
TEST61,37324807504913,"stories15M, quantize, rv64gcv_vifmm","One day, Lily met a Shoggoth. She was very excited to see it. 
Lily said to the Shape. ""What do you do?"" 
The Shape bars were very sharp and it was very rare. Lily said, ""It's so rare. I can balance on one leg very well.""
Lily had a lot of fun with Shape crayons. She was so proud of her new shape.
Lily and Shog shared a big smile. They had a lot of fun together.",115,5.402813
TEST62,37697779304830,"stories15M, no_quantize, rv64gc","One day, Lily met a Shoggoth in the park. He had a special sticker on it. Lily said, ""What is your name?""
The Shog says, ""My name is Shape. I have a nice sticker in my back. It has a picture of a horse. Do you want to see it?""
Lily nodded. She was curious. She reached for the sticker. She wanted to know how it tasted. She shook it. It was spicy. She spit it out.
Lily said, ""This is spicy! That means it does not taste good. That is cool.""
He asked, ""How does it taste?""
Lily said, ""You can't eat it. You have to wait a little bit. Next time, I will tell you the rules of the stethoscope. We can trade, or read the instructions. We can both taste good.""
Lily said, ""OK. I will try the scale. I will keep learning."" She was happy. She said, ""Thank you. You are a good friend.""",234,1.270282
TEST62,37697779304830,"stories15M, quantize, rv64gc","One day, Lily met a Shoggoth in the park. He had a special weapon, a knight, that protected her from danger. 
Lily said, ""I want to be a fireman when I grow up, Mister Monk.""
The Shapeed said, ""Ok, if you can't have a job, let's go and play in the park instead. We can go on adventures and use our knight skills!""
So, Lily and Shog went and had a lot of fun playing with the other kids in the park. Even when Lily found out that her new club was much bigger than most useful. 
Lily and Shog stayed friends forever, and when they grew up, Lily decided to be a knight who had worked hard to protect her club. And, on her first year of becoming a mighty fireman, Lily was happy and proud of her own knight skills.",200,1.007254
TEST62,37697779304830,"stories15M, quantize, rv64gcv","One day, Lily met a Shoggoth in the park. He had a special weapon, a knight, that protected her from danger. 
Lily said, ""I want to be a fireman when I grow up, Mister Monk.""
The Shapeed said, ""Ok, if you can't have a job, let's go and play in the park instead. We can go on adventures and use our knight skills!""
So, Lily and Shog went and had a lot of fun playing with the other kids in the park. Even when Lily found out that her new club was much bigger than most useful. 
Lily and Shog stayed friends forever, and when they grew up, Lily decided to be a knight who had worked hard to protect her club. And, on her first year of becoming a mighty fireman, Lily was happy and proud of her own knight skills.",200,4.976147
TEST62,37697779304830,"stories15M, quantize, rv64gcv_vifmm","One day, Lily met a Shoggoth in the park. He had a special word in his eye. Lily said, ""What is the word?""
The Shog says, ""It means 'please'."" Lily did not know. She asked, ""What is 'please"", but no one said it. She was confused. 
Then, Lily's mom called out, ""Lily, come here. It's time for lunch."" Lily ran over to her mom. Her mom smiled and said, ""Lily, the word is 'hreeze'. If you say 'please' it!""
Lily was surprised. She looked at the sh End of her body and her head. She thought for a moment. Then, she said, ""Yummy!"" She was so happy and not confused anymore.
From then on, Lily always remembered the word ""hairy"".",195,5.192418
TEST63,38162898296746,"stories15M, no_quantize, rv64gc","One day, Lily met a Shoggoth in the park. She was amazed by its original shapes and colours. She asked, ""What is your name?""
The Shog said, ""My name is Tom. What is yours?""
Lily said, ""I don't know. It's a secret.""
Tom smiled and said, ""Would you like to see?""
Lily said, ""Yes!""
Tom closed his eyes and took out a small bag. He said, ""What is inside?"".
Lily opened her eyes and looked at the bag. It was full of glittering diamonds.
Tom said, ""Wow! This is amazing!""
Lily said, ""I can't wait to show it to our friends.""
Tom said, ""Yay! Let's go to the party."" 
They held hands and walked together. They shared the diamonds with everyone. Everyone was happy to see the unique treasure.",209,1.273950
TEST63,38162898296746,"stories15M, quantize, rv64gc","One day, Lily met a Shoggoth in the park. She was amazed by its power. She asked, ""What can I do with this?""
The Shurtuble answered, ""I can solve the mystery of the evil.""
Lily asked, ""What kind of evil?"". The Shurtuble explained, ""A dangerous wolf wants to eat me. I can eat you"".
Lily was scared, so she asked, ""What should I do?"". The Shog correctly answered, ""You must escape!"". 
Lily screamed and ran away. The Shurtbornia followed her, but it was too late. The Shscreen and the soap were covered in dangerous creatures. Lily was hurt, and she had been bitten. 
The shy Shapeve left in the park, sad and lonely. She never found out the mysterious powers, and she stayed in the park forever.",201,1.007164
TEST63,38162898296746,"stories15M, quantize, rv64gcv","One day, Lily met a Shoggoth in the park. She was amazed by its power. She asked, ""What can I do with this?""
The Shurtuble answered, ""I can solve the mystery of the evil.""
Lily asked, ""What kind of evil?"". The Shurtuble explained, ""A dangerous wolf wants to eat me. I can eat you"".
Lily was scared, so she asked, ""What should I do?"". The Shog correctly answered, ""You must escape!"". 
Lily screamed and ran away. The Shurtbornia followed her, but it was too late. The Shscreen and the soap were covered in dangerous creatures. Lily was hurt, and she had been bitten. 
The shy Shapeve left in the park, sad and lonely. She never found out the mysterious powers, and she stayed in the park forever.",201,4.973897
TEST64,38621963139814,"stories15M, quantize, rv64gc","One day, Lily met a Shoggoth in the park. He was unique and shiny. Lily thought it was cool and asked him, ""What is this?""
The Shter,"" He explain, ""It is a spoon. I use it to help me spin"". Lily was curious and asked if she could try it.
The Shbebrate fairy said, ""Yes, but remember to take good care of it. It can do something special."" 
Lily was amazed! She thanked the Shapeglist and grabbed the spoon. She was so happy with the solution. She used the spoon to spin around and around in circles until she was dizzy. 
Lily had learnt an important lesson that day. She always took care of her unique things.",174,1.009889
TEST64,38621963139814,"stories15M, quantize, rv64gcv","One day, Lily met a Shoggoth in the park. He was unique and shiny. Lily thought it was cool and asked him, ""What is this?""
The Shter,"" He explain, ""It is a spoon. I use it to help me spin"". Lily was curious and asked if she could try it.
The Shbebrate fairy said, ""Yes, but remember to take good care of it. It can do something special."" 
Lily was amazed! She thanked the Shapeglist and grabbed the spoon. She was so happy with the solution. She used the spoon to spin around and around in circles until she was dizzy. 
Lily had learnt an important lesson that day. She always took care of her unique things.",174,5.041005
TEST66,39648117980356,"stories15M, no_quantize, rv64gc","One day, Lily met a Shoggoth. She was very excited. ""Wow!"" she said. ""What can I do with it?""
The Shog glowed and said ""You can make me shiny"".
Lily said ""That is cool!""
The Shog went off to the art room and began shining. It was so bright and beautiful! Lily saw the colors and sang a song.
""This is so much fun!"" she said.
The Shogs said ""You are amazing! Let's make your hair neat and clean now"".
Lily was so happy that she had a new friend. She knew that he was a gifted person who could make shiny things.",153,1.281831
TEST66,39648117980356,"stories15M, quantize, rv64gc","One day, Lily met a Shoggoth. She was very excited. ""Wow, a Shog!"" she said. 
The Shog rubbed Lily's hand. It felt nice and warm.
Lily asked, ""What does your hands feel like?""
The Shurtamdo shouted, ""A balloon is coming!""
Lily was so happy. She said, ""Let's play with it!""
The Shogg wouldn't stop. He wanted to play too. But Lily was still happy because she wanted to keep her unique friend happy. 
So the Shog was the one who rubbed Lily's hand. Now they could play together every day.",153,1.011782
TEST66,39648117980356,"stories15M, quantize, rv64gcv","One day, Lily met a Shoggoth. She was very excited. ""Wow, a Shog!"" she said. 
The Shog rubbed Lily's hand. It felt nice and warm.
Lily asked, ""What does your hands feel like?""
The Shurtamdo shouted, ""A balloon is coming!""
Lily was so happy. She said, ""Let's play with it!""
The Shogg wouldn't stop. He wanted to play too. But Lily was still happy because she wanted to keep her unique friend happy. 
So the Shog was the one who rubbed Lily's hand. Now they could play together every day.",153,5.088442
TEST66,39648117980356,"stories15M, quantize, rv64gcv_vifmm","One day, Lily met a Shoggoth. She was very excited. ""Wow, a Shog!"" she said. 
The Shog rubbed against her arm and said, ""Hello, Lily! You look very friendly.""
Lily asked the Shog, ""What does friendly mean?"" 
The Shouseried shirt said, ""Be kind to everyone you meet. You never know who you can be."" 
Lily smiled and said, ""Thank you! I'll be kind to everyone and I will always be kind!"" 
The Shruca smiled back and said, ""It's okay. I'm glad I was kind to you."" 
Lily was so happy to have met Shog. She gave him a big hug and ran off to play. 
The End.",176,5.243347
TEST67,39986933223840,"stories15M, no_quantize, rv64gc","One day, Lily met a Shoggoth at the park. She was so excited! She asked her mom if she could take it home with her. Her mom said yes and said she could take it home with her. 
Lily couldn't wait to get home and show it to her friends. So, she carefully picked it up and took it to the park. When she got there, she showed it to everyone. 
Her friends looked at the shiny shirt, so Lily said ""It's ok if you take it home. You can keep it."" Everyone agreed, and they all went home with their new shirt. 
At home, Lily and her friends looked at it with a smile. She said ""Treasureman the coin!"" They were so excited and thankful to have such a lovely friend.",179,1.278224
TEST67,39986933223840,"stories15M, quantize, rv64gc","One day, Lily met a Shoggoth at the park. She was so excited! She asked her mom if she could take it home with her. Her mom said yes and said she could take it home with her. 
Lily couldn't wait to get home and show it to her friends. So, she carefully picked it up and took it to the park. When she got there, she showed it to everyone. 
Her friends looked at it and laughed. They told Lily she had gained something very special from finding the shirt. Lily was so excited and she was sure that the shirt was a lucky find. 
When Lily arrived home, she opened the shirt and took off the shirt. She was about to put it back on when her mom saw the shirt and said, ""Lily, what did you find? That shirt is so good."" 
Lily smiled, still with a smile, said, ""I found it on the ground!"" Her mom was very happy and praised her for being so clever.",224,1.005520
TEST67,39986933223840,"stories15M, quantize, rv64gcv","One day, Lily met a Shoggoth at the park. She was so excited! She asked her mom if she could take it home with her. Her mom said yes and said she could take it home with her. 
Lily couldn't wait to get home and show it to her friends. So, she carefully picked it up and took it to the park. When she got there, she showed it to everyone. 
Her friends looked at it and laughed. They told Lily she had gained something very special from finding the shirt. Lily was so excited and she was sure that the shirt was a lucky find. 
When Lily arrived home, she opened the shirt and took off the shirt. She was about to put it back on when her mom saw the shirt and said, ""Lily, what did you find? That shirt is so good."" 
Lily smiled, still with a smile, said, ""I found it on the ground!"" Her mom was very happy and praised her for being so clever.",224,4.934078
TEST67,39986933223840,"stories15M, quantize, rv64gcv_vifmm","One day, Lily met a Shoggoth at the park. She was so excited! She asked her mom if she could take it home with her. Her mom said yes and put it in a safe place where Lily could take care of it.
On the way home, Lily was sad. She cried and cried, but her mom had a warning for her. She said that the Shoggock was harsh and could make her very scared.
That night, when Lily looked out of her window, the Shwn Monster she saw earlier was gone. She asked her mom what it was, but her mom couldn't tell her. Lily never saw the Shorm Monster again. She always remembered it, the shirts in her shirt and the memories it gave her.",170,5.256965
TEST68,40432080041300,"stories15M, quantize, rv64gc","One day, Lily met a Shoggoth on a walk in the park. It had a big smile on its face and a fancy dress, and was sparkling in the sun. Lily was so happy to meet the Shog.
She asked her mom what the Shog did. Her mom said it worked, and it would make Lily smile.
Lily and her mom followed the Shwn float in the air. Lily looked around, but the Shirt was right behind her. The Shister had given her the best hope and sparkle.
Lily and her mom were very happy, and they thanked the Shaveder for helping them find it.",141,1.012822
TEST68,40432080041300,"stories15M, quantize, rv64gcv","One day, Lily met a Shoggoth on a walk in the park. It had a big smile on its face and a fancy dress, and was sparkling in the sun. Lily was so happy to meet the Shog.
She asked her mom what the Shog did. Her mom said it worked, and it would make Lily smile.
Lily and her mom followed the Shwn float in the air. Lily looked around, but the Shirt was right behind her. The Shister had given her the best hope and sparkle.
Lily and her mom were very happy, and they thanked the Shaveder for helping them find it.",141,5.114761
TEST68,40432080041300,"stories15M, quantize, rv64gcv_vifmm","One day, Lily met a Shoggoth on a walk in the park. She wanted to keep it as a treasure. So, she asked the Shoggious if it would like to keep it. The Shog said yes and stopped in front of the bench.
Lily was so happy, she thanked the Shog cushion. She closed her eyes and opened her eyes to give the Shog gently at the time she had come. But when she opened her eyes, the shirt was gone!
The Shirt pig was gone too! Lily was very sad and she asked the Shog for help. The Shog flooded her living room and the ocean was dark. All the waves had destroyed everything. 
Lily was very scared. She wished she had never found the shirt. From that day on, she never went to the park again.",188,5.208557
TEST69,40840786046183,"stories15M, no_quantize, rv64gc","One day, Lily met a Shoggoth in the park. It was a very old, rusty with lots of buttons and lights. Lily wanted to keep the shirt, but it wouldn't fit anymore.
""Mom, can I please have the shirt with a button?"" asked Lily.
""Sure, sweetheart,"" said Mom.
Lily was so excited. She spent the whole day playing with the shirt. She tried on every button she could find, but she didn't like the same one that her mom had just bought. She felt confused.
""What's wrong with my shirt?"" she asked Mom.
""It doesn't fit anymore. How will I get to its spot?"" asked Mom.
""We can take it to the shop and get it!"" said Lily.
So they took the shirt to the shop and she soon realized the button was just the right size. Lily was happy because now she could take the shirt with her everyday.",219,1.272348
